{
    "$schema": "./model.schema.json",
    "name": "User",
    "label": "User",
    "description": "User model",
    "fields": [
        {
            "name": "first_name",
            "label": "first_name",
            "type": "string"
        },
        {
            "name": "last_name",
            "label": "last_name",
            "type": "string"
        }
    ]
}